[
  {
    "schema_version": 1,
    "record_contract": "normalized_v1",
    "id": "400779212",
    "created_at_raw": 1784272549000,
    "created_at": "2026-07-17T15:15:49+08:00",
    "title": "",
    "text": "可惜，没有后悔药。<br/>7月的风险，<br/>后知后觉是多么可怕。<br/>有人提前预知，完全避开，<br/>有人懵懵懂懂，全程吃土。<br/>希望关注我的，<br/>要独立思考，时刻保护自己。<br/>股市就是这样，<br/>可以让你赢很多次，<br/>但是一次巨大的亏损，<br/>可能好多年都缓不过来。<br/>五次重大风险的大跌，五次提醒，五次应验，<br/>这种应验，心中只会悲凉。<br/>因为市场并没有基于制度，发展红利改变很多，<br/>虽然有，但是不多。<br/>参与A股，还是不能掉以轻心。",
    "clean_text": "可惜，没有后悔药。\n7月的风险，\n后知后觉是多么可怕。\n有人提前预知，完全避开，\n有人懵懵懂懂，全程吃土。\n希望关注我的，\n要独立思考，时刻保护自己。\n股市就是这样，\n可以让你赢很多次，\n但是一次巨大的亏损，\n可能好多年都缓不过来。\n五次重大风险的大跌，五次提醒，五次应验，\n这种应验，心中只会悲凉。\n因为市场并没有基于制度，发展红利改变很多，\n虽然有，但是不多。\n参与A股，还是不能掉以轻心。",
    "target": "https://xueqiu.com/7143769715/400779212",
    "reply_count": 119,
    "like_count": 568,
    "retweet_count": 2,
    "view_count": 0
  },
  {
    "schema_version": 1,
    "record_contract": "normalized_v1",
    "id": "400772830",
    "created_at_raw": 1784271581000,
    "created_at": "2026-07-17T14:59:41+08:00",
    "title": "",
    "text": "本月诸多不利，都是与米相关。<br/>比如石油方向，撕毁协议→通胀→加息<br/>比如海力士ADR，→利益分配问题<br/>比如美光苹果吵架，→利益分配问题<br/>比如脸书卖空闲算力，引导→过剩问题<br/>比如日汇率岌岌可危，→亚太金融风险<br/>比如10年期米债利率飙升突破4.5，操纵嫌疑<img src=\"//assets.imedao.com/ugc/images/face/emoji_51.png?v=1\" title=\"[偷笑]\" alt=\"[偷笑]\" height=\"24\" /><br/>比如黄金白银→重回比特币涌入白银时候的价格，热钱涌动加强投机引发各种杠杆攀升。<br/>这种变化背后，<br/>A股主导资金是量化。<br/>从抖音站在光里群魔乱舞，<br/>猪模块，猴模块，西游记，<br/>各种劣币驱逐良币行为频繁。<br/>很明显，量化内部也分价值与收割。<br/>收割的就是波动的钱。",
    "clean_text": "本月诸多不利，都是与米相关。\n比如石油方向，撕毁协议→通胀→加息\n比如海力士ADR，→利益分配问题\n比如美光苹果吵架，→利益分配问题\n比如脸书卖空闲算力，引导→过剩问题\n比如日汇率岌岌可危，→亚太金融风险\n比如10年期米债利率飙升突破4.5，操纵嫌疑\n比如黄金白银→重回比特币涌入白银时候的价格，热钱涌动加强投机引发各种杠杆攀升。\n这种变化背后，\nA股主导资金是量化。\n从抖音站在光里群魔乱舞，\n猪模块，猴模块，西游记，\n各种劣币驱逐良币行为频繁。\n很明显，量化内部也分价值与收割。\n收割的就是波动的钱。",
    "target": "https://xueqiu.com/7143769715/400772830",
    "reply_count": 20,
    "like_count": 259,
    "retweet_count": 1,
    "view_count": 0
  },
  {
    "schema_version": 1,
    "record_contract": "normalized_v1",
    "id": "400768917",
    "created_at_raw": 1784270952000,
    "created_at": "2026-07-17T14:49:12+08:00",
    "title": "",
    "text": "锚定日韩的4/5/6月的科技行情，<br/>盈亏同源。<br/>如果走极端，还是可能月线一阴穿三阳。<br/>我也没有办法。<br/>结果其实很明显，<br/>就是一次有预谋的恶意做空。<br/>核心路径就是，<br/>通过杠杆化放大波动，比如5月韩国推出多只单一个股的杠杆产品，这种杠杆资金推动快速上涨，从而引发市场结构性恶化（量化被引导是大概率的）。比如K型分化就是这种恶化结果。<br/>如今距离发行杠杆品种的点位一步之遥。<br/>后续可能有踩踏恐慌，不过从历史节点的思考，<br/>跌破等于杠杆出清。<br/>不管这种杠杆出清是爆仓还是主动去杠杆。<br/>结果就是，市场推倒重来了。<img src=\"//assets.imedao.com/ugc/images/face/emoji_61_xieyan.png?v=1\" title=\"[斜眼]\" alt=\"[斜眼]\" height=\"24\" />",
    "clean_text": "锚定日韩的4/5/6月的科技行情，\n盈亏同源。\n如果走极端，还是可能月线一阴穿三阳。\n我也没有办法。\n结果其实很明显，\n就是一次有预谋的恶意做空。\n核心路径就是，\n通过杠杆化放大波动，比如5月韩国推出多只单一个股的杠杆产品，这种杠杆资金推动快速上涨，从而引发市场结构性恶化（量化被引导是大概率的）。比如K型分化就是这种恶化结果。\n如今距离发行杠杆品种的点位一步之遥。\n后续可能有踩踏恐慌，不过从历史节点的思考，\n跌破等于杠杆出清。\n不管这种杠杆出清是爆仓还是主动去杠杆。\n结果就是，市场推倒重来了。",
    "target": "https://xueqiu.com/7143769715/400768917",
    "reply_count": 42,
    "like_count": 286,
    "retweet_count": 1,
    "view_count": 0
  },
  {
    "schema_version": 1,
    "record_contract": "normalized_v1",
    "id": "400764612",
    "created_at_raw": 1784270197000,
    "created_at": "2026-07-17T14:36:37+08:00",
    "title": "",
    "text": "7月交易，量力而行。<br/>今日打破原有下跌趋势，<br/>意味着盘面超卖了。<br/>因此，趋势走势有修正需求，<br/>修正需求是一次改善市场的契机，<br/>因此我觉得决定参与。<br/>后续需要看xx场外力量引导。<br/>这个契机能否扩大成一次反弹，<br/>我没有把握。<br/>如果修正的机会不把握，<br/>后面恐怕还有恐慌。<br/>这不是抄底行为，是一次基于偏离的修正。<br/>截教教义，为天下苍生，截取一线生机。<br/>下周一，韩国市场开门，<br/>视野又会锚定韩国，<br/>如果韩国与日本继续引发亚太恐慌。<br/>总之，7月风险演绎过程，<br/>第一个时间节点并没有改变做空的猖獗，<br/>只能期待第二个时间节点。<br/>zzj年中经济会议。",
    "clean_text": "7月交易，量力而行。\n今日打破原有下跌趋势，\n意味着盘面超卖了。\n因此，趋势走势有修正需求，\n修正需求是一次改善市场的契机，\n因此我觉得决定参与。\n后续需要看xx场外力量引导。\n这个契机能否扩大成一次反弹，\n我没有把握。\n如果修正的机会不把握，\n后面恐怕还有恐慌。\n这不是抄底行为，是一次基于偏离的修正。\n截教教义，为天下苍生，截取一线生机。\n下周一，韩国市场开门，\n视野又会锚定韩国，\n如果韩国与日本继续引发亚太恐慌。\n总之，7月风险演绎过程，\n第一个时间节点并没有改变做空的猖獗，\n只能期待第二个时间节点。\nzzj年中经济会议。",
    "target": "https://xueqiu.com/7143769715/400764612",
    "reply_count": 32,
    "like_count": 387,
    "retweet_count": 2,
    "view_count": 0
  },
  {
    "schema_version": 1,
    "record_contract": "normalized_v1",
    "id": "400757028",
    "created_at_raw": 1784268928000,
    "created_at": "2026-07-17T14:15:28+08:00",
    "title": "",
    "text": "<a href=\"https://xueqiu.com/7143769715/400123004\" title=\"https://xueqiu.com/7143769715/400123004\" target=\"_blank\" class=\"status-link\">网页链接</a><br/>海力士ADR的27%大涨，催命符。<br/>随后做空，<br/>直接抹除涨幅，引发亚太极端恐慌。<br/>周四韩国熔断，<br/>周四韩国四部分闭门会议传出来的声音是，<br/>加息。更加引导恐慌。<br/>加息是为了应对通胀保汇率。<br/>周五韩国制宪日，休市一天。<br/>由于周四晚上美股引导恐慌，<br/>周五亚太日本暴跌引导恐慌。<br/>整个过程，都是米引导亚太股市恐慌，<br/>从而传导我国引发波动风险。<br/>波动的幅度越来越大，<br/>因此，走势极端。<br/>盘面，高股息为主的拉升护盘，<br/>其他方向都遭遇重挫。",
    "clean_text": "网页链接\n海力士ADR的27%大涨，催命符。\n随后做空，\n直接抹除涨幅，引发亚太极端恐慌。\n周四韩国熔断，\n周四韩国四部分闭门会议传出来的声音是，\n加息。更加引导恐慌。\n加息是为了应对通胀保汇率。\n周五韩国制宪日，休市一天。\n由于周四晚上美股引导恐慌，\n周五亚太日本暴跌引导恐慌。\n整个过程，都是米引导亚太股市恐慌，\n从而传导我国引发波动风险。\n波动的幅度越来越大，\n因此，走势极端。\n盘面，高股息为主的拉升护盘，\n其他方向都遭遇重挫。",
    "target": "https://xueqiu.com/7143769715/400757028",
    "reply_count": 20,
    "like_count": 211,
    "retweet_count": 0,
    "view_count": 0
  },
  {
    "schema_version": 1,
    "record_contract": "normalized_v1",
    "id": "400749999",
    "created_at_raw": 1784267981000,
    "created_at": "2026-07-17T13:59:41+08:00",
    "title": "",
    "text": "市场恐慌，已经跌破下跌趋势通道。",
    "clean_text": "市场恐慌，已经跌破下跌趋势通道。",
    "target": "https://xueqiu.com/7143769715/400749999",
    "reply_count": 65,
    "like_count": 300,
    "retweet_count": 0,
    "view_count": 0
  }
]
