[
  {
    "schema_version": 1,
    "id": "394570122",
    "created_at_raw": "2026-06-13 02:46:12",
    "created_at": "2026-06-13T02:46:12+08:00",
    "title": "Space-x",
    "text": "<p>三大业务，</p><p>火箭发射，</p><p><a href=\"https://xueqiu.com/S/SZ980018?from=status_stock_match\" class=\"xq_stock\">卫星通信</a>，</p><p>太空AI。</p><p>贵不贵因时而异。</p><p>1，火箭发射为全球国家服务。这个业务要扩张，需要全球把目光放向太空经济。即大航海时代2.0→太空时代。</p><p>2，星链是卫星互联网对传统互联网渗透率过程。渗透率与全球用户增量相关，目前增速日百万级别。这个是跑通生意模式的，是基本盘。</p><p>3，太空AI目前还没有可靠的营收与盈利项目。（技术壁垒过高，融资+投入的利润亏损阶段）这个方向非常大胆，开辟了全新的赛道。不管成功与否，都是人类向未知的一大前进。理想主义色彩拉满。科学工作者无尽的追逐与梦想的缩影→创新的意义。</p><p>1和2基本盘，1.2万亿市值是合理的。3无法估值。因为这不是一个可以用所谓市盈率市销率等财务指标衡量的。那么不能作为投资视角，就只能按照融资视角对待。</p><p>收盘2.1万亿，假设市场定价是准确的。差异0.9万亿美元就是融资额度。而美国2025全年GDP30万亿美元。相当于GDP的3%支持发展。</p><p>根据《美国创新战略》及新财长贝森特提出的“3-3-3”经济方略中，明确设定的国家研究与开发投入目标，即把GDP的3%以上用于研发。从美国战略看，3%就是合理的。</p><p>Space-x上市落地，估值贵有贵的道理。这里的核心意义在于，是否以space-x为引擎开辟新的经济增长道路。众所周知，美国一季度GDP增长拆解后，真正增长的方向，80%以上与Ai相关。</p><p>而space-x从性质看，是典型的军民融合项目。而历史的美国科技推动增长，军民融合项目诞生了许多伟大企业。比如<a href=\"https://xueqiu.com/S/AAPL?from=status_stock_match\" class=\"xq_stock\">苹果</a>，<a href=\"https://xueqiu.com/S/MSFT?from=status_stock_match\" class=\"xq_stock\">微软</a>都是美苏冷战下的产，是米放弃直接军事冲突，转为推动私人民营企业经济发展。面对挑战，又修炼内功。这是成功的发展经验。我国也在学习。</p><p>当space-x 上市，意味着这种发展正式搬上台面。市值的波动与行业的盛衰，在未来都有了清晰的记录。比如美国大基建时代，钢铁与铁路主宰了市场。利弗莫尔在伯利恒钢铁的交易至今津津乐道。当时资本疯狂的程度，不亚于今天。钢铁与铁路几乎占据了50%以上成交，这种历史看，space-x推动全新产业的开端，其行业盛衰也会在未来数十年表现。这只是开始。</p><p>马斯克不是财务投资者，他直言巴菲特的投资理念不会给人类带来帮助，只不过是在盈利的数学中打圈圈。space-x，剔除Ai市值高估，1.2万亿市值也是超过伯克希尔。因此，谁对谁错，是需要时间证明的。</p><p>投资者，在迷雾中前进，在未知中押注。不得不面临这个问题。投资理念是否真的与时俱进？</p><p>在一个问题上，我选择持有并支持space-x。理由是，在巴菲特退出投资<a href=\"https://xueqiu.com/S/SZ002594?from=status_stock_match\" class=\"xq_stock\">比亚迪</a>的时候，比亚迪的质疑与下跌，让我觉得，巴菲特再也很难投资到伟大企业。早期的价值发展固然重要，而发展的轨迹已经截然不同。</p><p>在贝森特眼中，能源主导经济带来的诸多经济波动，会随着能源的可控不再是周期性演绎。我理解是，war的风险在快速下降，通过武力争夺资源已经是死胡同。因此，推动新的需求，让资源有效配置，才是争夺的关键。而创新与研发，推动这种需求，是非常重要的。这一点，从我国<a href=\"https://xueqiu.com/S/SH000941?from=status_stock_match\" class=\"xq_stock\">新能源</a>的需求推动，带动了锂钴磷等资源的重新定义。我是认同的。</p><p>我是一个好奇心非常强的人。我希望看看不一样的世界。于是我购买了space-x。并不是投资，也不是收益。好比时光相册的一个瞬间，我留下点记忆。<img src=\"//assets.imedao.com/ugc/images/face/emoji_76_rich.png?v=1\" title=\"[暴富]\" alt=\"[暴富]\" height=\"24\" />这也意味着，我会长期跟踪太空经济相关的产业。这就是兴趣的动力来源。<img src=\"//assets.imedao.com/ugc/images/face/emoji_38_flower.png?v=1\" title=\"[献花花]\" alt=\"[献花花]\" height=\"24\" /><img src=\"//assets.imedao.com/ugc/images/face/emoji_38_flower.png?v=1\" title=\"[献花花]\" alt=\"[献花花]\" height=\"24\" /><img src=\"//assets.imedao.com/ugc/images/face/emoji_38_flower.png?v=1\" title=\"[献花花]\" alt=\"[献花花]\" height=\"24\" /></p><p>我在星链之初就关注了太空经济与商业航天。因此是为数不多，在市场没有暴涨就购买这类股票的。并且2023开始更新时，第一大主题题材交易，就是参与了<a href=\"https://xueqiu.com/S/SZ980018?from=status_stock_match\" class=\"xq_stock\">卫星通信</a>。即<a href=\"https://xueqiu.com/S/SH601698?from=status_stock_match\" class=\"xq_stock\">中国卫通</a><a href=\"https://xueqiu.com/S/SH600118?from=status_stock_match\" class=\"xq_stock\">中国卫星</a>。这种交易来源于我对军民融合推动经济发展的历史理解。而产业驱动，则来自“中国星网”的组建，众所周知就是抖音的广泛传播以及中国登月时间表，2030年。而美国是2029年。因此，太空竞赛的竞争发展格局确立，这也是能够在商业航天那一波大行情有封神明场面的原因。因此，产业投资者，很多时候并不是原地踏步。真正带给你财富的知识，都是日积月累的。</p>",
    "clean_text": "三大业务，\n火箭发射，\n卫星通信，\n太空AI。\n贵不贵因时而异。\n1，火箭发射为全球国家服务。这个业务要扩张，需要全球把目光放向太空经济。即大航海时代2.0→太空时代。\n2，星链是卫星互联网对传统互联网渗透率过程。渗透率与全球用户增量相关，目前增速日百万级别。这个是跑通生意模式的，是基本盘。\n3，太空AI目前还没有可靠的营收与盈利项目。（技术壁垒过高，融资+投入的利润亏损阶段）这个方向非常大胆，开辟了全新的赛道。不管成功与否，都是人类向未知的一大前进。理想主义色彩拉满。科学工作者无尽的追逐与梦想的缩影→创新的意义。\n1和2基本盘，1.2万亿市值是合理的。3无法估值。因为这不是一个可以用所谓市盈率市销率等财务指标衡量的。那么不能作为投资视角，就只能按照融资视角对待。\n收盘2.1万亿，假设市场定价是准确的。差异0.9万亿美元就是融资额度。而美国2025全年GDP30万亿美元。相当于GDP的3%支持发展。\n根据《美国创新战略》及新财长贝森特提出的“3-3-3”经济方略中，明确设定的国家研究与开发投入目标，即把GDP的3%以上用于研发。从美国战略看，3%就是合理的。\nSpace-x上市落地，估值贵有贵的道理。这里的核心意义在于，是否以space-x为引擎开辟新的经济增长道路。众所周知，美国一季度GDP增长拆解后，真正增长的方向，80%以上与Ai相关。\n而space-x从性质看，是典型的军民融合项目。而历史的美国科技推动增长，军民融合项目诞生了许多伟大企业。比如苹果，微软都是美苏冷战下的产，是米放弃直接军事冲突，转为推动私人民营企业经济发展。面对挑战，又修炼内功。这是成功的发展经验。我国也在学习。\n当space-x 上市，意味着这种发展正式搬上台面。市值的波动与行业的盛衰，在未来都有了清晰的记录。比如美国大基建时代，钢铁与铁路主宰了市场。利弗莫尔在伯利恒钢铁的交易至今津津乐道。当时资本疯狂的程度，不亚于今天。钢铁与铁路几乎占据了50%以上成交，这种历史看，space-x推动全新产业的开端，其行业盛衰也会在未来数十年表现。这只是开始。\n马斯克不是财务投资者，他直言巴菲特的投资理念不会给人类带来帮助，只不过是在盈利的数学中打圈圈。space-x，剔除Ai市值高估，1.2万亿市值也是超过伯克希尔。因此，谁对谁错，是需要时间证明的。\n投资者，在迷雾中前进，在未知中押注。不得不面临这个问题。投资理念是否真的与时俱进？\n在一个问题上，我选择持有并支持space-x。理由是，在巴菲特退出投资比亚迪的时候，比亚迪的质疑与下跌，让我觉得，巴菲特再也很难投资到伟大企业。早期的价值发展固然重要，而发展的轨迹已经截然不同。\n在贝森特眼中，能源主导经济带来的诸多经济波动，会随着能源的可控不再是周期性演绎。我理解是，war的风险在快速下降，通过武力争夺资源已经是死胡同。因此，推动新的需求，让资源有效配置，才是争夺的关键。而创新与研发，推动这种需求，是非常重要的。这一点，从我国新能源的需求推动，带动了锂钴磷等资源的重新定义。我是认同的。\n我是一个好奇心非常强的人。我希望看看不一样的世界。于是我购买了space-x。并不是投资，也不是收益。好比时光相册的一个瞬间，我留下点记忆。这也意味着，我会长期跟踪太空经济相关的产业。这就是兴趣的动力来源。\n我在星链之初就关注了太空经济与商业航天。因此是为数不多，在市场没有暴涨就购买这类股票的。并且2023开始更新时，第一大主题题材交易，就是参与了卫星通信。即中国卫通中国卫星。这种交易来源于我对军民融合推动经济发展的历史理解。而产业驱动，则来自“中国星网”的组建，众所周知就是抖音的广泛传播以及中国登月时间表，2030年。而美国是2029年。因此，太空竞赛的竞争发展格局确立，这也是能够在商业航天那一波大行情有封神明场面的原因。因此，产业投资者，很多时候并不是原地踏步。真正带给你财富的知识，都是日积月累的。",
    "target": "https://xueqiu.com/7143769715/394570122",
    "reply_count": 83,
    "like_count": 433,
    "retweet_count": 6,
    "view_count": 0,
    "record_contract": "normalized_v1"
  }
]
